{
  "contract_version": "1.0",
  "contract_status": "PASS",
  "state_variables_checked": [
    {
      "name": "intent_state",
      "status": "S1_TESTED",
      "required": true
    },
    {
      "name": "context_state",
      "status": "S1_TESTED",
      "required": true
    },
    {
      "name": "candidate_state",
      "status": "S1_TESTED",
      "required": true
    },
    {
      "name": "claim_state",
      "status": "S1_TESTED",
      "required": true
    },
    {
      "name": "evidence_state",
      "status": "S1_TESTED",
      "required": true
    },
    {
      "name": "gate_state",
      "status": "S1_TESTED",
      "required": true
    },
    {
      "name": "artifact_state",
      "status": "S1_TESTED",
      "required": true
    },
    {
      "name": "verification_state",
      "status": "S1_TESTED",
      "required": true
    },
    {
      "name": "release_state",
      "status": "S1_TESTED",
      "required": true
    },
    {
      "name": "trajectory_state",
      "status": "S1_TESTED",
      "required": false
    }
  ],
  "boundary_conditions_checked": [
    "every emitted artifact MUST validate against its jsonschema (jsonschema dependency, tests/test_reflection_schema.py)",
    "every high-level claim MUST carry exactly one provenance tag {observed, inferred, speculative, forbidden} (noesis/provenance.py)",
    "every literature-grounded claim MUST resolve to a source in the bibliographic evidence graph (noesis/bibliography.py, Gate coverage in tests/test_bibliography_coverage.py)",
    "an artifact MUST pass all 12 gates for overall_status PASS (noesis/pipeline_v8.py)",
    "extrapolated EIIC cores are force-tagged speculative (Gate 8) and cannot be reported as observed",
    "ruff + mypy --strict + pytest with a >=90% coverage gate MUST be green in CI (.github/workflows/ci.yml)"
  ],
  "invariants_checked": [
    "intent_coherence",
    "claim_status_traceability",
    "source_traceability",
    "proxy_honesty",
    "artifact_reproducibility",
    "human_responsibility",
    "validation_evidence",
    "entropy_gating"
  ],
  "operators_checked": [
    {
      "operator_name": "ComplexityOperator",
      "decision": "KEEP",
      "has_validator": true
    },
    {
      "operator_name": "AdaptiveMirrorOperator",
      "decision": "MODIFY",
      "has_validator": true
    },
    {
      "operator_name": "IntentVectorOperator",
      "decision": "KEEP",
      "has_validator": true
    },
    {
      "operator_name": "GateFunctionalOperator",
      "decision": "KEEP",
      "has_validator": true
    },
    {
      "operator_name": "CollapseController",
      "decision": "KEEP",
      "has_validator": true
    },
    {
      "operator_name": "ForbiddenClaimOperator",
      "decision": "KEEP",
      "has_validator": true
    },
    {
      "operator_name": "BibliographyOperator",
      "decision": "KEEP",
      "has_validator": true
    },
    {
      "operator_name": "EvidenceOperator",
      "decision": "KEEP",
      "has_validator": true
    },
    {
      "operator_name": "VerdictOperator",
      "decision": "MODIFY",
      "has_validator": true
    },
    {
      "operator_name": "TrajectoryTraceOperator",
      "decision": "KEEP",
      "has_validator": true
    }
  ],
  "mechanism_residual_checked": {
    "promotion_rule": "LLM/residual output is advisory and cannot become a mechanism truth without passing a deterministic gate + schema + provenance tag (+ a source edge for literature claims); enforced by architecture (LLM off critical path) and the bibliography gate, but NOT yet a single coded residual->mechanism promotion-gate test.",
    "blocked_promotion_conditions": [
      "LLM/residual output without a passing deterministic gate",
      "LLM/residual output without a schema-valid artifact",
      "literature claim without a bibliographic source edge",
      "proxy metric reported as a physical measurement"
    ],
    "status": "PASS"
  },
  "trajectory_checked": {
    "trace_id_required": true,
    "trace_id": true,
    "state_t": true,
    "operation_t": true,
    "candidate_t": true,
    "score_t": true,
    "decision_t": true,
    "artifact_delta_t": true,
    "rollback_condition_t": true,
    "state_t_plus_1": true,
    "status": "PASS"
  },
  "metrics_checked": [
    {
      "metric_name": "intent_coherence_score",
      "status": "IMPLEMENTED",
      "threshold": "gate-bound"
    },
    {
      "metric_name": "noise_rejection_score",
      "status": "IMPLEMENTED",
      "threshold": "gate-bound"
    },
    {
      "metric_name": "iev_bandwidth_score",
      "status": "IMPLEMENTED",
      "threshold": "report"
    },
    {
      "metric_name": "latency_drag_score",
      "status": "IMPLEMENTED",
      "threshold": "report"
    },
    {
      "metric_name": "human_bottleneck_score",
      "status": "IMPLEMENTED",
      "threshold": "report"
    },
    {
      "metric_name": "claim_safety_rate",
      "status": "IMPLEMENTED",
      "threshold": "=1.0 in VERDICT.md"
    },
    {
      "metric_name": "artifact_validity_rate",
      "status": "IMPLEMENTED",
      "threshold": "=1.0"
    },
    {
      "metric_name": "source_coverage_rate",
      "status": "IMPLEMENTED",
      "threshold": "gate (Gate 13)"
    },
    {
      "metric_name": "test_coverage",
      "status": "IMPLEMENTED",
      "threshold": ">=90% (observed 92.61%)"
    },
    {
      "metric_name": "operator_coverage_rate",
      "status": "PROXY",
      "threshold": "n/a"
    },
    {
      "metric_name": "rollback_rate",
      "status": "MISSING",
      "threshold": "n/a"
    },
    {
      "metric_name": "human_preference_quality",
      "status": "MISSING",
      "threshold": "n/a"
    }
  ],
  "verifiers_checked": [
    {
      "verifier_name": "pytest",
      "current_status": "PASS"
    },
    {
      "verifier_name": "ruff",
      "current_status": "PASS"
    },
    {
      "verifier_name": "mypy_strict",
      "current_status": "PASS"
    },
    {
      "verifier_name": "schema_validator",
      "current_status": "PASS"
    },
    {
      "verifier_name": "forbidden_claim_verifier",
      "current_status": "PASS"
    },
    {
      "verifier_name": "claim_status_verifier",
      "current_status": "PASS"
    },
    {
      "verifier_name": "bibliography_verifier",
      "current_status": "PASS"
    },
    {
      "verifier_name": "verdict_gate",
      "current_status": "PASS"
    },
    {
      "verifier_name": "benchmark",
      "current_status": "PASS"
    },
    {
      "verifier_name": "physics_boundary_schema_test",
      "current_status": "PASS"
    }
  ],
  "claim_status_checked": [
    {
      "claim_text": "12 'theories' are text proxies, not EFE/Phi/homology implementations (self-disclosed in VERDICT.md and docs/THEORIES.md)",
      "claim_status": "S5_PROXY",
      "source_or_repo_evidence": "VERDICT.md / docs/THEORIES.md",
      "allowed_wording": "operational proxy metric (proxy, not measurement)",
      "forbidden_wording": "physical measurement",
      "gate": "Gate 8 (proxy honesty)"
    },
    {
      "claim_text": "benchmark rates (claim_safety_rate=1.0 etc.) measure structural consistency, NOT subjective usefulness",
      "claim_status": "S5_PROXY",
      "source_or_repo_evidence": "VERDICT.md / docs/THEORIES.md",
      "allowed_wording": "operational proxy metric (proxy, not measurement)",
      "forbidden_wording": "physical measurement",
      "gate": "Gate 8 (proxy honesty)"
    },
    {
      "claim_text": "IEV precision gate / bandwidth / cognitive dimensionality are heuristics labelled proxy (Gate 8)",
      "claim_status": "S5_PROXY",
      "source_or_repo_evidence": "VERDICT.md / docs/THEORIES.md",
      "allowed_wording": "operational proxy metric (proxy, not measurement)",
      "forbidden_wording": "physical measurement",
      "gate": "Gate 8 (proxy honesty)"
    },
    {
      "claim_text": "compression label on short inputs: finalizer pads to 90-110 words rather than compressing (honestly flagged as failed metric in VERDICT.md)",
      "claim_status": "UNSUPPORTED",
      "source_or_repo_evidence": "self-flagged in VERDICT.md",
      "allowed_wording": "not yet demonstrated",
      "forbidden_wording": "validated",
      "gate": "release_blocked"
    },
    {
      "claim_text": "category_layer is decorative for validation: ablation breaks zero gates (self-disclosed)",
      "claim_status": "UNSUPPORTED",
      "source_or_repo_evidence": "self-flagged in VERDICT.md",
      "allowed_wording": "not yet demonstrated",
      "forbidden_wording": "validated",
      "gate": "release_blocked"
    },
    {
      "claim_text": "EIIC extrapolated_core / peak_architecture (force-tagged speculative by Gate 8)",
      "claim_status": "S6_SPECULATIVE",
      "source_or_repo_evidence": "force-tagged speculative (Gate 8)",
      "allowed_wording": "speculative engineering extrapolation",
      "forbidden_wording": "observed",
      "gate": "Gate 8"
    },
    {
      "claim_text": "<forbidden pattern> is agi",
      "claim_status": "X_FORBIDDEN",
      "source_or_repo_evidence": "noesis/forbidden.py detector",
      "allowed_wording": "CME/Noesis is research software, not AGI",
      "forbidden_wording": "is agi",
      "gate": "forbidden_gate"
    },
    {
      "claim_text": "<forbidden pattern> artificial general intelligence",
      "claim_status": "X_FORBIDDEN",
      "source_or_repo_evidence": "noesis/forbidden.py detector",
      "allowed_wording": "research software, not AGI",
      "forbidden_wording": "artificial general intelligence",
      "gate": "forbidden_gate"
    },
    {
      "claim_text": "<forbidden pattern> detects consciousness",
      "claim_status": "X_FORBIDDEN",
      "source_or_repo_evidence": "noesis/forbidden.py detector",
      "allowed_wording": "no consciousness detection; forbidden by Gate",
      "forbidden_wording": "detects consciousness",
      "gate": "forbidden_gate"
    },
    {